{
  "schema_version": "subject-index-policy-build-input-v1",
  "policy_id": "policy-test",
  "source_scope": {
    "source_sha256": "aaaaaaaaaaaaaaaaaaaaaaaaaaaaaaaaaaaaaaaaaaaaaaaaaaaaaaaaaaaaaaaa",
    "document_page_span": [1, 20],
    "page_map_sha256": "bbbbbbbbbbbbbbbbbbbbbbbbbbbbbbbbbbbbbbbbbbbbbbbbbbbbbbbbbbbbbbbb",
    "chunk_manifest_sha256": "cccccccccccccccccccccccccccccccccccccccccccccccccccccccccccccccc",
    "availability": {
      "body_text": "present",
      "notes": "absent",
      "captions": "present"
    },
    "source_specific_excluded": [
      "endnotes absent from supplied source"
    ]
  },
  "audience": {
    "label": "scholars_and_students",
    "basis": "inferred",
    "confidence": "high",
    "rationale": "Academic press history with scholarly apparatus and specialist historiographical discussion."
  },
  "audit_design": {
    "mode": "full",
    "candidate_blindness": "required"
  },
  "deviations": []
}
